{
  "$schema": "https://json-schema.org/draft/2020-12/schema",
  "$id": "https://jaszczur.dev/schemas/jh_vscode_project.schema.json",
  "title": "JaszczurHAL VS Code Project",
  "type": "object",
  "additionalProperties": true,
  "properties": {
    "project": {
      "type": "string",
      "minLength": 1
    },
    "module": {
      "type": "string",
      "minLength": 1
    },
    "toolchain": {
      "type": "string",
      "enum": ["cmake", "esp-idf", "custom"]
    },
    "target": {
      "type": "string",
      "minLength": 1,
      "description": "Active target family id (e.g. rp2040, rp2350-arm, rp2350-riscv, stm32g474, esp32s3). Absent = rp2040."
    },
    "board": {
      "type": "string",
      "minLength": 1,
      "description": "Active physical board profile id within the active target (resolved against boards/targets and boards/profiles)."
    },
    "assembly": {
      "type": "string",
      "minLength": 1,
      "description": "Assembly key of the project's device_tree.json; the assembly fixes target and board. Valid only with device_tree.json, which rejects 'target' and 'board'."
    },
    "buildDir": {
      "type": "string",
      "minLength": 1
    },
    "cmakeBuildDir": {
      "type": "string",
      "minLength": 1
    },
    "cmake": {
      "type": "object",
      "additionalProperties": true,
      "properties": {
        "sourceDir": {
          "type": "string",
          "minLength": 1
        },
        "executable": {
          "type": "string",
          "minLength": 1,
          "description": "Optional explicit CMake executable. The verified Windows bootstrap path is used by default on native Windows."
        },
        "generator": {
          "type": "string",
          "minLength": 1,
          "description": "Optional CMake generator override. Firmware builds default to Ninja."
        },
        "cache": {
          "type": "object",
          "description": "CMake cache entries of the tooling: paths, toolchain and module settings. The HAL configuration of the project (features, compile definitions, sources and variants) lives only in hal_project_config.h, so HAL_ENABLE_*, HAL_DISABLE_*, EXTRA_HAL_DEFINES, JH_EXTRA_DEFINES, JH_PROJECT_SOURCES and JH_VARIANT are rejected here; a variant is selected with --variant.",
          "propertyNames": {
            "not": {
              "anyOf": [
                { "enum": ["EXTRA_HAL_DEFINES", "JH_EXTRA_DEFINES", "JH_PROJECT_SOURCES", "JH_VARIANT"] },
                { "pattern": "^HAL_(ENABLE|DISABLE)_[A-Z0-9_]+$" }
              ]
            }
          },
          "additionalProperties": {
            "type": ["string", "number", "integer", "boolean", "null"]
          }
        },
        "targets": {
          "type": "object",
          "description": "CMake target-name alias map (build/buildDebug/upload/compileDb -> concrete CMake target names). NOT a multi-target profile map; see targetProfiles.",
          "additionalProperties": {
            "type": "string"
          }
        }
      }
    },
    "espIdf": {
      "type": "object",
      "description": "ESP-IDF tooling contract supplied by the target registry.",
      "additionalProperties": true,
      "properties": {
        "runner": {
          "type": "string",
          "minLength": 1
        },
        "artifactManifest": {
          "type": "string",
          "minLength": 1
        }
      }
    },
    "targetProfiles": {
      "type": "object",
      "description": "Per-target overlay manifests, keyed by target id (rp2040, rp2350-arm, stm32g474, ...). Deliberately NOT named 'targets' to avoid colliding with cmake.targets. The active target's overlay is deep-merged over the base manifest during resolution; absent = single implicit native rp2040 profile.",
      "additionalProperties": {
        "type": "object",
        "additionalProperties": true,
        "properties": {
          "toolchain": {
            "type": "string",
            "enum": ["cmake", "esp-idf", "custom"]
          },
          "board": {
            "type": "string",
            "minLength": 1,
            "description": "Board used when this target is active; must be registered for this target. Local state and --board take precedence."
          },
          "buildDir": { "type": "string" },
          "cmakeBuildDir": { "type": "string" },
          "cmake": { "type": "object", "additionalProperties": true },
          "espIdf": { "type": "object", "additionalProperties": true },
          "upload": { "type": "object", "additionalProperties": true },
          "identity": { "type": "object", "additionalProperties": true },
          "artifacts": { "type": "object", "additionalProperties": true },
          "ota": { "type": "object", "additionalProperties": true }
        }
      }
    },
    "identity": {
      "type": "object",
      "additionalProperties": true,
      "properties": {
        "enabled": {
          "type": "boolean"
        },
        "usbManufacturer": {
          "type": "string"
        },
        "usbProduct": {
          "type": "string"
        },
        "usbSerialNumber": {
          "type": "string"
        },
        "usbInterface": {
          "type": "string"
        },
        "usbLocation": {
          "type": "string"
        },
        "usbVid": {
          "oneOf": [
            { "type": "integer", "minimum": 0, "maximum": 65535 },
            { "type": "string" }
          ]
        },
        "usbPid": {
          "oneOf": [
            { "type": "integer", "minimum": 0, "maximum": 65535 },
            { "type": "string" }
          ]
        },
        "byIdHint": {
          "type": "string"
        }
      }
    },
    "artifacts": {
      "type": "object",
      "additionalProperties": true,
      "properties": {
        "elf": {
          "type": "string"
        },
        "uf2": {
          "type": "string"
        },
        "ota": {
          "type": "string"
        },
        "compileCommands": {
          "type": "string"
        }
      }
    },
    "upload": {
      "type": "object",
      "description": "Upload configuration. Stable dispatcher paths cover RP-family UF2/serial-style upload, STM32 OpenOCD, and ESP-IDF flash.",
      "additionalProperties": true,
      "properties": {
        "strategy": {
          "type": "string",
          "enum": ["serial", "uf2", "custom", "openocd", "esptool", "esp-idf"]
        },
        "port": {
          "type": "string"
        },
        "bootselVolume": {
          "type": "string",
          "description": "Optional user-local BOOTSEL drive root or Windows volume GUID used to disambiguate UF2 upload."
        },
        "byId": {
          "type": "string"
        },
        "openocd": {
          "type": "object",
          "description": "OpenOCD parameters for strategy=openocd (SWD flash, e.g. STM32). No serial port / BOOTSEL / by-id identity logic applies.",
          "additionalProperties": true,
          "properties": {
            "bin": { "type": "string" },
            "interface": { "type": "string" },
            "target": { "type": "string" }
          }
        }
      }
    },
    "ota": {
      "type": "object",
      "description": "Native RP OTA discovery and authenticated upload settings.",
      "additionalProperties": true,
      "properties": {
        "hostname": { "type": "string" },
        "host": { "type": "string" },
        "port": {
          "type": "integer",
          "minimum": 1,
          "maximum": 65535,
          "default": 8266
        },
        "listenPort": {
          "type": "integer",
          "minimum": 0,
          "maximum": 65535,
          "default": 8266,
          "description": "Host port for the TCP callback and for UDP discovery replies. Set zero explicitly to request ephemeral ports."
        },
        "broadcast": { "type": "string" },
        "password": {
          "type": "string",
          "description": "Inline development-only password; prefer passwordEnv."
        },
        "passwordEnv": { "type": "string" },
        "allowEmptyPassword": { "type": "boolean" }
      }
    },
    "hooks": {
      "type": "object",
      "description": "Reserved hook configuration. The current runtime preserves/expands this section as data, but does not provide a stable executed hook system.",
      "additionalProperties": true,
      "properties": {
        "preBuild": {
          "type": "string"
        },
        "postBuild": {
          "type": "string"
        },
        "preUpload": {
          "type": "string"
        },
        "postUpload": {
          "type": "string"
        }
      }
    }
  }
}
